Icon;PlaceType;Name_ESP;Name_ENG;Description_ESP;Description_ENG;Option1_ESP;Option1_ENG;Answer1_ESP;Answer1_ENG;Item1;Effect1;Option2_ESP;Option2_ENG;Answer2_ESP;Answer2_ENG;Item2;Effect2;Option3_ESP;Option3_ENG;Answer3_ESP;Answer3_ENG;Item3;Effect3#
3;RUINS;" Ruinas aisladas";Isolated ruins;"Frente a Aunia descansa lo que queda de la carcasa de lo que antaño parecía ser un gran salón de piedra. La mitad superior así como la pared este han desaparecido y no hay ni rastro de las piedras con las que fue construida esa sección. Es como si un ente gigante, de un terrible golpe, las hubiese lanzado por los aires.

Desde fuera se puede apreciar perfectamente el interior sin necesidad de acercarse a la puerta. Muebles destrozados y una gran mesa partida a la mitad son lo único que queda. 

Da la impresión de que la estructura servía a algún propósito en concreto, pero parece no ser más que un gran salón de comidas.";"In front of Aunia lies the remains of the shell of what once appeared to be a large stone hall. The upper half and the east wall have disappeared and there is no trace of the stones from which that section was built. It is as if a giant entity, with a terrible blow, had thrown them into the air.

From outside, the interior can be seen perfectly without having to go near the door. Shattered furniture and a large table broken in half are all that remains.

It seems that the structure served some specific purpose, but it appears to be nothing more than a large dining hall.";Buscar superficialmente en el interior;Search superficially inside;"Aunia decide hacer un pequeño alto en el camino pero sin desviarse mucho de su rumbo, atraviesa lo que queda de la puerta y mira las estanterías. Solo queda polvo en ellas y los restos rotos de diferentes enseres para las mesas.

Suspira, no esperaba encontrar nada realmente. Con esa idea en mente se acerca a los restos de la mesa. Hay comida esparcida por el suelo, la mayoría en mal estado, pero bajo un plato, accidentalmente cubierto para resistir las inclemencias del tiempo, encuentra un trozo de carne que quizás pueda aprovechar si está muy necesitada.

Lleva ya mucho rato aquí. Guarda el trozo de carne en un trapo y lo mete en su mochila, dispuesta a reanudar el camino mientras se recuerda a sí misma que no todos los lugares son una mina de piedras preciosas.";"Aunia decides to make a short stop on the way but without deviating too much from her course. She goes through what remains of the door and looks at the shelves. Only dust remains on them and the broken remains of different tableware.

She sighs, she didn't really expect to find anything. With that idea in mind, she approaches the remains of the table. There is food scattered on the floor, most of it spoiled, but under a plate, accidentally covered to resist the inclement weather, she finds a piece of meat that she might be able to use if she is in dire need.

She has been here for a long time now. She puts the piece of meat in a rag and puts it in her backpack, ready to resume her journey while reminding herself that not every place is a mine of precious stones.";10;;Buscar a conciencia en las ruinas;Searching thoroughly in the ruins;"¿Por qué razón hay un salón en medio de la nada? Piensa Aunia. Parece un lugar de reunión, donde la gente compartía momentos largos mientras comía. Un lugar así necesita una cocina cerca y mirando al páramo que la rodea no ve nada así en las inmediaciones.

Aunia pasa las siguientes horas explorando cada rincón que aún queda en pie de la estructura. Al fin da con lo que buscaba. Bajo un amasijo destrozado de tablones que antaño fueron unas lustrosas estanterías encuentra una pequeña trampilla que baja al subsuelo. Saca la fuente de luz que lleva guardada en la mochila y se interna en la oscuridad.

Apenas unos metros bajo tierra encuentra la cocina, perfectamente conservada. Lo que pasó en la superficie no ha afectado al interior. Abre los cajones y la despensa, para su sorpresa aún encuentra algunas cosas útiles.

Mientras vuelve a la superficie se lamenta un poco de haber empleado tanto tiempo en la búsqueda, pero hoy cenará bien con el botín que ha encontrado.";"Why is there a living room in the middle of nowhere? Aunia thinks. It looks like a meeting place, where people shared long moments while eating. A place like that needs a kitchen nearby and looking at the moor around her she sees nothing like that in the immediate vicinity.

Aunia spends the next few hours exploring every corner of the structure that is still standing. At last she finds what she was looking for. Under a broken mass of planks that were once shiny shelves she finds a small trapdoor that goes down to the basement. She takes out the light source she has kept in her backpack and goes into the darkness.

Just a few meters underground she finds the kitchen, perfectly preserved. What happened on the surface has not affected the interior. She opens the drawers and the pantry, to her surprise she still finds some useful things.

As she returns to the surface she regrets a little having spent so much time searching, but today she will have a good dinner with the loot she has found.";1;9;No perder tiempo aquí;Don't waste time here;Desde lejos las ruinas despiertan cierta curiosidad en Aunia pero ya ha aprendido que en ocasiones hay que saber ahorrar el tiempo. Un montón de rocas en mitad de la nada a veces son simplemente más nada, es mejor emplear sus fuerzas en otra cosa.;From a distance, the ruins arouse a certain curiosity in Aunia, but she has already learned that sometimes you have to know how to save time. A pile of rocks in the middle of nowhere is sometimes just more nothing, it is better to use your energy on something else.;;10